"Canada_Alberta","Canada_British Columbia","Canada_Manitoba","Canada_New Brunswick","Canada_Newfoundland and Labrador","Canada_Nova Scotia","Canada_Ontario","Canada_Quebec","China","France","India","Italy","Japan","Netherlands","Portugal","Russia","South Africa","Spain","Thailand","United Kingdom","USA","node","node.state","node.lik","node.par","node.desc","par.state","desc.state","desc.n","desc.accession","par.lik","desc.lik","nested"
0.0149753227606194,0.0374751870362107,0.00951784419336494,0.010464041538118,0.00939361066599845,0.00962304316072908,0.190625729228896,0.302396264185418,0.240101423250012,0.00978619153989678,0.00933500173290384,0.00954975341511552,0.00931742668154097,0.00943099761220958,0.00932089942519236,0.009407943249054,0.00932031946246227,0.0119823186945681,0.00984152434769987,0.0540297680436778,0.0241053897763127,143,"Canada_Quebec",0.302396264185418,142,"1, 2, 3, 4, 5, 6, 7, 8, 9, 10, 11, 12, 13, 14, 15, 16, 17, 18, 19, 20, 21, 22, 23, 24, 25, 26, 27, 28, 29, 30, 31, 32, 33, 34, 35, 36, 37, 38, 39, 40, 41, 42, 43, 44, 45, 46, 47, 48, 49, 50, 51, 52, 53, 54, 55, 56, 57, 58, 59, 60, 61, 62, 63, 64, 65, 66, 67, 68, 69, 70, 71, 72, 73, 74, 75, 76, 77, 78, 79, 80, 81, 82, 83, 84, 85, 86, 87, 88, 89, 90, 91, 92, 93, 94, 95, 96, 97, 98, 99, 100, 101, 102, 103, 104, 105, 106, 107, 108, 109, 110, 111, 112, 113, 114, 115, 116, 117, 118, 119, 120, 121, 122, 123, 124, 125, 126, 127, 128, 129, 130, 131, 132, 133, 134, 135, 136, 137, 138, 139, 140","China","Canada_Ontario, Canada_Quebec, Canada_Quebec, Canada_Ontario, USA, Canada_Quebec, United Kingdom, Portugal, Canada_Ontario, Portugal, Canada_Manitoba, Canada_Ontario, Canada_Ontario, Canada_Nova Scotia, Canada_British Columbia, Canada_British Columbia, United Kingdom, Canada_Quebec, Canada_Ontario, United Kingdom, USA, Canada_Quebec, United Kingdom, Canada_Ontario, Canada_Ontario, USA, Canada_Ontario, USA, Canada_Ontario, Canada_Nova Scotia, Canada_Quebec, Canada_Ontario, Canada_Alberta, Italy, Canada_Quebec, Canada_Ontario, France, Spain, United Kingdom, Canada_British Columbia, United Kingdom, Canada_Alberta, Canada_Alberta, Canada_Nova Scotia, Canada_Ontario, Canada_Ontario, Canada_Alberta, USA, Canada_Quebec, United Kingdom, Canada_Nova Scotia, Canada_Ontario, Canada_Ontario, USA, Canada_Quebec, Canada_Ontario, Canada_Ontario, Thailand, USA, Canada_Alberta, Netherlands, Canada_Ontario, USA, USA, USA, France, India, Canada_Alberta, Canada_Ontario, Russia, Canada_Manitoba, Canada_Quebec, Canada_Alberta, Canada_Manitoba, Canada_Ontario, Canada_Alberta, Canada_Alberta, Canada_Alberta, Canada_Alberta, Canada_British Columbia, United Kingdom, Canada_Ontario, Canada_Ontario, Canada_Ontario, Canada_Quebec, Canada_Quebec, Canada_Ontario, Canada_Ontario, United Kingdom, Canada_Quebec, Canada_Alberta, Canada_New Brunswick, USA, Canada_Nova Scotia, Canada_Quebec, Canada_Quebec, Canada_Ontario, USA, United Kingdom, Canada_Alberta, France, Canada_Quebec, Canada_Quebec, United Kingdom, Canada_British Columbia, Canada_Ontario, Canada_British Columbia, United Kingdom, Canada_Ontario, Canada_Ontario, United Kingdom, United Kingdom, France, Canada_Ontario, Canada_Quebec, USA, Canada_Quebec, Canada_Quebec, Canada_Quebec, Canada_British Columbia, Canada_Quebec, Canada_Manitoba, USA, Canada_Ontario, Canada_Alberta, Canada_Quebec, Canada_Newfoundland and Labrador, USA, Canada_British Columbia, Canada_Ontario, Canada_Ontario, South Africa, Canada_Nova Scotia, Canada_Quebec, Canada_Ontario, United Kingdom, United Kingdom, Canada_Quebec, Japan, USA",140,"EPI_ISL_FAKE_146, EPI_ISL_FAKE_48, EPI_ISL_FAKE_53, EPI_ISL_FAKE_127, EPI_ISL_FAKE_181, EPI_ISL_FAKE_67, EPI_ISL_FAKE_185, EPI_ISL_FAKE_94, EPI_ISL_FAKE_169, EPI_ISL_FAKE_47, EPI_ISL_FAKE_115, EPI_ISL_FAKE_164, EPI_ISL_FAKE_167, EPI_ISL_FAKE_84, EPI_ISL_FAKE_4, EPI_ISL_FAKE_3, EPI_ISL_FAKE_7, EPI_ISL_FAKE_55, EPI_ISL_FAKE_32, EPI_ISL_FAKE_22, EPI_ISL_FAKE_69, EPI_ISL_FAKE_21, EPI_ISL_FAKE_140, EPI_ISL_FAKE_106, EPI_ISL_FAKE_174, EPI_ISL_FAKE_15, EPI_ISL_FAKE_16, EPI_ISL_FAKE_51, EPI_ISL_FAKE_50, EPI_ISL_FAKE_38, EPI_ISL_FAKE_128, EPI_ISL_FAKE_83, EPI_ISL_FAKE_87, EPI_ISL_FAKE_132, EPI_ISL_FAKE_57, EPI_ISL_FAKE_166, EPI_ISL_FAKE_195, EPI_ISL_FAKE_9, EPI_ISL_FAKE_70, EPI_ISL_FAKE_8, EPI_ISL_FAKE_23, EPI_ISL_FAKE_79, EPI_ISL_FAKE_91, EPI_ISL_FAKE_101, EPI_ISL_FAKE_49, EPI_ISL_FAKE_161, EPI_ISL_FAKE_66, EPI_ISL_FAKE_113, EPI_ISL_FAKE_27, EPI_ISL_FAKE_36, EPI_ISL_FAKE_82, EPI_ISL_FAKE_173, EPI_ISL_FAKE_191, EPI_ISL_FAKE_35, EPI_ISL_FAKE_44, EPI_ISL_FAKE_63, EPI_ISL_FAKE_68, EPI_ISL_FAKE_14, EPI_ISL_FAKE_99, EPI_ISL_FAKE_76, EPI_ISL_FAKE_40, EPI_ISL_FAKE_148, EPI_ISL_FAKE_24, EPI_ISL_FAKE_118, EPI_ISL_FAKE_192, EPI_ISL_FAKE_54, EPI_ISL_FAKE_131, EPI_ISL_FAKE_86, EPI_ISL_FAKE_175, EPI_ISL_FAKE_129, EPI_ISL_FAKE_134, EPI_ISL_FAKE_42, EPI_ISL_FAKE_80, EPI_ISL_FAKE_33, EPI_ISL_FAKE_171, EPI_ISL_FAKE_97, EPI_ISL_FAKE_100, EPI_ISL_FAKE_72, EPI_ISL_FAKE_77, EPI_ISL_FAKE_58, EPI_ISL_FAKE_71, EPI_ISL_FAKE_5, EPI_ISL_FAKE_6, EPI_ISL_FAKE_163, EPI_ISL_FAKE_46, EPI_ISL_FAKE_75, EPI_ISL_FAKE_109, EPI_ISL_FAKE_172, EPI_ISL_FAKE_189, EPI_ISL_FAKE_56, EPI_ISL_FAKE_85, EPI_ISL_FAKE_37, EPI_ISL_FAKE_103, EPI_ISL_FAKE_73, EPI_ISL_FAKE_114, EPI_ISL_FAKE_45, EPI_ISL_FAKE_74, EPI_ISL_FAKE_178, EPI_ISL_FAKE_124, EPI_ISL_FAKE_93, EPI_ISL_FAKE_184, EPI_ISL_FAKE_117, EPI_ISL_FAKE_12, EPI_ISL_FAKE_196, EPI_ISL_FAKE_61, EPI_ISL_FAKE_147, EPI_ISL_FAKE_64, EPI_ISL_FAKE_159, EPI_ISL_FAKE_25, EPI_ISL_FAKE_162, EPI_ISL_FAKE_2, EPI_ISL_FAKE_34, EPI_ISL_FAKE_120, EPI_ISL_FAKE_126, EPI_ISL_FAKE_52, EPI_ISL_FAKE_19, EPI_ISL_FAKE_29, EPI_ISL_FAKE_39, EPI_ISL_FAKE_41, EPI_ISL_FAKE_60, EPI_ISL_FAKE_78, EPI_ISL_FAKE_135, EPI_ISL_FAKE_92, EPI_ISL_FAKE_160, EPI_ISL_FAKE_81, EPI_ISL_FAKE_28, EPI_ISL_FAKE_30, EPI_ISL_FAKE_17, EPI_ISL_FAKE_59, EPI_ISL_FAKE_176, EPI_ISL_FAKE_165, EPI_ISL_FAKE_179, EPI_ISL_FAKE_26, EPI_ISL_FAKE_10, EPI_ISL_FAKE_170, EPI_ISL_FAKE_31, EPI_ISL_FAKE_123, EPI_ISL_FAKE_13, EPI_ISL_FAKE_65, EPI_ISL_FAKE_122",0.999999907042446,"0.999999907042446, 0.302396264185418, 0.302396259203854, 0.52712551600171, 0.527125589986474, 0.450930737263137, 0.450930743069581, 0.586309056105709, 0.595705899283139, 0.595705898703926, 0.617175876441261, 0.528905337353653, 0.723130385598561, 0.249121440051644, 0.309221899763241, 0.309221937723071, 0.614273324391887, 0.959971821526376, 0.999999984321582, 0.406851821122694, 0.383063919992461, 0.496649716843044, 0.556469961597133, 0.999999992496861, 0.478634535123036, 0.238333411031707, 0.74732622142869, 0.239114236928402, 0.478634581722053, 0.234945861739615, 0.234945860790807, 0.272951528947894, 0.272951555626063, 0.98410394637249, 0.51220288252599, 0.252681565071247, 0.286106857901806, 0.415803487156939, 0.478634620066443, 0.528986714820845, 0.528986688442746, 0.500771351148628, 0.377230852201979, 0.26396348533216, 0.525833371323871, 0.983658165082646, 0.983658423156651, 0.983658007078754, 0.403265367786273, 0.403265382209219, 0.871041367791678, 0.871041362162304, 0.874856331531623, 0.565555285603512, 0.40326535588503, 0.722994380253875, 0.403265253890364, 0.892164661668592, 0.403265210780596, 0.934587781338676, 0.403265178087268, 0.698754312989079, 0.687337062446449, 0.63703785840681, 0.637037702483715, 0.605760281709326, 0.667379356292471, 0.822691148497467, 0.822691184097646, 0.707402253211717, 0.868681911605296, 0.868681900526095, 0.868681892072349, 0.555316140731705, 0.543480442400907, 0.265481894220693, 0.506322001453196, 0.506321861377455, 0.506321788773537, 0.999999769075809, 0.99543948254552, 0.50632216180317, 0.526351681392485, 0.252625054926437, 0.252625060689641, 0.996849303001727, 0.252625071177157, 0.633137440095854, 0.633137392057208, 0.306019771846793, 0.218301425408654, 0.273579002048778, 0.799415570740084, 0.805356872926846, 0.828672783453456, 0.963421915909157, 0.798173225814351, 0.999241925120915, 0.600129538182144, 0.633137467740386, 0.768667775614886, 0.999848887498637, 0.72931195469507, 0.785775014257154, 0.78577501099534, 0.729975805446038, 0.643034126854361, 0.35226302835993, 0.352263033225947, 0.351367765897551, 0.352263030529952, 0.727483876823817, 0.35226303351411, 0.718034498705108, 0.333927452871411, 0.333927419779313, 0.937946081311281, 0.938277999648243, 0.854823541439669, 0.854823544935431, 0.359880336579719, 0.352017046064991, 0.352017117424365, 0.376860384544268, 0.320712266393751, 0.920856286428759, 0.999999937889368, 0.999999660757422, 0.999999401415133, 0.915352518806481, 0.937946083301371, 0.938379450020609, 0.942593531729853, 0.937946071630902, 0.886804798949858, 0.714382809072373, 0.823115118399933, 0.82311503934124, 0.395289390759852, 0.999999161698386",NA
0.00921064285367428,0.0241526617333459,0.00443070215304459,0.00443657542062699,0.00442993100653141,0.0110745316058946,0.104794647495157,0.595705899283139,0.00586198776683054,0.007088902206396,0.00442956720735784,0.00443090022111158,0.00442945811491696,0.00443016307615888,0.00442947967104635,0.00443001997235242,0.0044294760710773,0.00444599972087333,0.00443271131130679,0.179896267670936,0.00902947543822138,150,"Canada_Quebec",0.595705899283139,145,"94, 95, 96, 97, 98, 99, 100, 101, 102, 103, 104, 105, 106, 107, 108, 109, 110","United Kingdom","Canada_Nova Scotia, Canada_Quebec, Canada_Quebec, Canada_Ontario, USA, United Kingdom, Canada_Alberta, France, Canada_Quebec, Canada_Quebec, United Kingdom, Canada_British Columbia, Canada_Ontario, Canada_British Columbia, United Kingdom, Canada_Ontario, Canada_Ontario",17,"EPI_ISL_FAKE_73, EPI_ISL_FAKE_114, EPI_ISL_FAKE_45, EPI_ISL_FAKE_74, EPI_ISL_FAKE_178, EPI_ISL_FAKE_124, EPI_ISL_FAKE_93, EPI_ISL_FAKE_184, EPI_ISL_FAKE_117, EPI_ISL_FAKE_12, EPI_ISL_FAKE_196, EPI_ISL_FAKE_61, EPI_ISL_FAKE_147, EPI_ISL_FAKE_64, EPI_ISL_FAKE_159, EPI_ISL_FAKE_25, EPI_ISL_FAKE_162",0.52712551600171,"0.805356872926846, 0.828672783453456, 0.963421915909157, 0.798173225814351, 0.999241925120915, 0.600129538182144, 0.633137467740386, 0.768667775614886, 0.999848887498637, 0.72931195469507, 0.785775014257154, 0.78577501099534, 0.729975805446038, 0.643034126854361, 0.35226302835993, 0.352263033225947, 0.351367765897551","nested"
3.40425954910332e-09,2.72045429321011e-09,2.71773633751976e-09,2.71765825590624e-09,2.717540573028e-09,0.999999769075809,1.56792175370053e-07,1.01956712766949e-08,2.71919240010954e-09,2.7176987497158e-09,2.71756265905891e-09,2.71756389867222e-09,2.71753991040522e-09,2.71768786220301e-09,2.71754051778307e-09,2.71765790732108e-09,2.71753995453819e-09,2.71781496590224e-09,2.91009702533326e-09,4.37496409527315e-09,1.5195835266813e-08,221,"Canada_Nova Scotia",0.999999769075809,220,"51, 52, 53","USA","Canada_Nova Scotia, Canada_Ontario, Canada_Ontario",3,"EPI_ISL_FAKE_82, EPI_ISL_FAKE_173, EPI_ISL_FAKE_191",0.506321788773537,"0.871041367791678, 0.871041362162304, 0.874856331531623","nested"
0.010185835152417,0.00723199711059949,0.00660824927476605,0.00659033230123642,0.00656329796912836,0.00863909845634588,0.171231633502857,0.252625054926437,0.00694241334517838,0.00659964174749521,0.00656842639633993,0.00656867583683169,0.0065631727782231,0.0065971219265813,0.00656325503634195,0.00659023041019635,0.00656317753184513,0.00662629530669276,0.231220708238753,0.0125976625806364,0.220323720171098,225,"Canada_Quebec",0.252625054926437,217,"55, 56, 57, 58, 59","USA","Canada_Quebec, Canada_Ontario, Canada_Ontario, Thailand, USA",5,"EPI_ISL_FAKE_44, EPI_ISL_FAKE_63, EPI_ISL_FAKE_68, EPI_ISL_FAKE_14, EPI_ISL_FAKE_99",0.265481894220693,"0.40326535588503, 0.722994380253875, 0.403265253890364, 0.892164661668592, 0.403265210780596","nested"
0.351367765897551,0.0160077191886116,0.0159012981389645,0.0158396209998037,0.0158333532139199,0.0158359136612908,0.313665094315821,0.0184627573489509,0.0159212493747296,0.0173949200859754,0.0160963736633171,0.015834600047877,0.0158333241889829,0.017533163311054,0.0158333432601504,0.0158741984352235,0.0158333252910883,0.0158479588576447,0.0158696464106116,0.0159144071779223,0.0432999671305094,251,"Canada_Alberta",0.351367765897551,250,"68, 69","USA","Canada_Alberta, Canada_Ontario",2,"EPI_ISL_FAKE_86, EPI_ISL_FAKE_175",0.352263033225947,"0.822691148497467, 0.822691184097646","nested"
0.00646433024927411,0.0895950933773019,0.00646326188898821,0.00645998213576302,0.0095435797696544,0.352017046064991,0.176911325558438,0.110406643007178,0.00648047851740894,0.0064599216339747,0.00645988136283761,0.00645990053058985,0.00645987979926579,0.00645988993099046,0.00645988010413033,0.00645988787326358,0.0289302806531461,0.00646011765023269,0.00645992657272787,0.00646387064465648,0.142124822675187,263,"Canada_Nova Scotia",0.352017046064991,262,"129, 130, 131, 132, 133","USA","Canada_British Columbia, Canada_Ontario, Canada_Ontario, South Africa, Canada_Nova Scotia",5,"EPI_ISL_FAKE_59, EPI_ISL_FAKE_176, EPI_ISL_FAKE_165, EPI_ISL_FAKE_179, EPI_ISL_FAKE_26",0.359880336579719,"0.999999401415133, 0.915352518806481, 0.937946083301371, 0.938379450020609, 0.942593531729853","nested"
