"Canada_Alberta","Canada_British Columbia","Canada_Manitoba","Canada_New Brunswick","Canada_Newfoundland and Labrador","Canada_Nova Scotia","Canada_Ontario","Canada_Quebec","China","France","India","Italy","Japan","Netherlands","Portugal","South Africa","Spain","Thailand","United Kingdom","USA","node","node.state","node.lik","node.par","node.desc","par.state","desc.state","desc.n","desc.accession","par.lik","desc.lik","nested"
0.0118073774601003,0.0280444854580426,0.00621886217951253,0.00622497099696506,0.00621889323844719,0.0141426797380533,0.0926615466928618,0.543347160269108,0.00738522760861523,0.00908071776256955,0.00621838503798846,0.00621889172975552,0.00621827410617286,0.00621905017280903,0.00621829537522346,0.00621829650288909,0.0062373688805967,0.0062218589320177,0.210024357072509,0.0150733007857627,152,"Canada_Quebec",0.543347160269108,145,"93, 94, 95, 96, 97, 98, 99, 100, 101, 102, 103, 104, 105, 106, 107, 108","United Kingdom","USA, Canada_Alberta, United Kingdom, France, Canada_Nova Scotia, Canada_Quebec, Canada_Quebec, Canada_Ontario, USA, Canada_Quebec, Canada_Quebec, Canada_British Columbia, Canada_Ontario, Canada_British Columbia, Canada_Ontario, Canada_Ontario",16,"EPI_ISL_FAKE_178, EPI_ISL_FAKE_93, EPI_ISL_FAKE_124, EPI_ISL_FAKE_184, EPI_ISL_FAKE_73, EPI_ISL_FAKE_114, EPI_ISL_FAKE_45, EPI_ISL_FAKE_74, EPI_ISL_FAKE_144, EPI_ISL_FAKE_12, EPI_ISL_FAKE_117, EPI_ISL_FAKE_61, EPI_ISL_FAKE_147, EPI_ISL_FAKE_64, EPI_ISL_FAKE_25, EPI_ISL_FAKE_162",0.665231323864378,"0.250893699942129, 0.779833135494799, 0.785594926673777, 0.811696998867353, 0.955319749098805, 0.778529942449636, 0.999068899535471, 0.587969478532555, 0.638626378221323, 0.768733323367841, 0.999883790657026, 0.721750756974931, 0.777196023264768, 0.777196019402594, 0.720947350430968, 0.336347586317505",NA
0.0234895139041571,0.10377338524776,0.00797138292287016,0.0115595028320771,0.00782509685292194,0.00847277060303323,0.455368081551059,0.157058616070237,0.06285187830032,0.00880888413492752,0.00785822977158857,0.00814298778391204,0.00779588665624756,0.00823203191671032,0.00780783978622683,0.00779694331653243,0.0185270458818181,0.00981053928813553,0.0331602912270597,0.043689091952407,167,"Canada_Ontario",0.455368081551059,144,"1, 2, 3, 4, 5, 6, 7, 8, 9, 10, 11, 12, 13, 14, 15, 16, 17, 18, 19, 20, 21, 22, 23, 24, 25, 26, 27, 28, 29, 30, 31, 32, 33, 34, 35, 36, 37, 38, 39, 40, 41, 42, 43, 44, 45, 46, 47, 48, 49, 50, 51, 52, 53, 54, 55, 56, 57, 58, 59, 60, 61, 62, 63, 64, 65, 66, 67, 68, 69, 70, 71, 72, 73, 74, 75, 76, 77, 78, 79, 80, 81, 82, 83, 84, 85, 86, 87, 88, 89, 90, 91, 92","China","Canada_Ontario, Canada_Ontario, Canada_Ontario, Portugal, United Kingdom, Portugal, Canada_Manitoba, Canada_Ontario, Canada_Quebec, Canada_Quebec, Canada_Ontario, USA, Canada_Quebec, Canada_Nova Scotia, Canada_British Columbia, Canada_British Columbia, United Kingdom, Canada_Ontario, Canada_Alberta, Spain, Italy, Canada_Quebec, Canada_Ontario, Canada_Quebec, Canada_Ontario, United Kingdom, USA, Canada_Ontario, Canada_Ontario, Canada_Quebec, USA, USA, United Kingdom, Canada_Ontario, Canada_Ontario, Canada_Nova Scotia, Canada_Quebec, France, Spain, United Kingdom, Canada_Ontario, Canada_Ontario, United Kingdom, Canada_British Columbia, United Kingdom, Canada_Alberta, Canada_Alberta, Canada_Nova Scotia, Canada_Alberta, USA, Canada_Quebec, United Kingdom, Canada_Nova Scotia, Canada_Ontario, Canada_Ontario, USA, Canada_Quebec, Canada_Ontario, Canada_Ontario, Thailand, USA, Canada_Alberta, Netherlands, Canada_Ontario, France, India, USA, USA, Canada_Alberta, Canada_Ontario, USA, Canada_Quebec, Canada_Alberta, Canada_Manitoba, Canada_Ontario, Canada_Alberta, Canada_Alberta, Canada_Alberta, Canada_Alberta, Canada_British Columbia, United Kingdom, Canada_Ontario, Canada_Ontario, Canada_Ontario, Canada_Quebec, Canada_Quebec, Canada_Ontario, Canada_Ontario, Canada_Quebec, Canada_Alberta, Canada_New Brunswick, USA",92,"EPI_ISL_FAKE_164, EPI_ISL_FAKE_167, EPI_ISL_FAKE_169, EPI_ISL_FAKE_94, EPI_ISL_FAKE_200, EPI_ISL_FAKE_47, EPI_ISL_FAKE_115, EPI_ISL_FAKE_146, EPI_ISL_FAKE_48, EPI_ISL_FAKE_53, EPI_ISL_FAKE_127, EPI_ISL_FAKE_181, EPI_ISL_FAKE_67, EPI_ISL_FAKE_84, EPI_ISL_FAKE_4, EPI_ISL_FAKE_3, EPI_ISL_FAKE_7, EPI_ISL_FAKE_83, EPI_ISL_FAKE_87, EPI_ISL_FAKE_112, EPI_ISL_FAKE_132, EPI_ISL_FAKE_57, EPI_ISL_FAKE_166, EPI_ISL_FAKE_55, EPI_ISL_FAKE_32, EPI_ISL_FAKE_22, EPI_ISL_FAKE_69, EPI_ISL_FAKE_106, EPI_ISL_FAKE_174, EPI_ISL_FAKE_21, EPI_ISL_FAKE_15, EPI_ISL_FAKE_51, EPI_ISL_FAKE_153, EPI_ISL_FAKE_16, EPI_ISL_FAKE_50, EPI_ISL_FAKE_38, EPI_ISL_FAKE_128, EPI_ISL_FAKE_195, EPI_ISL_FAKE_9, EPI_ISL_FAKE_70, EPI_ISL_FAKE_161, EPI_ISL_FAKE_49, EPI_ISL_FAKE_152, EPI_ISL_FAKE_8, EPI_ISL_FAKE_23, EPI_ISL_FAKE_79, EPI_ISL_FAKE_91, EPI_ISL_FAKE_101, EPI_ISL_FAKE_66, EPI_ISL_FAKE_113, EPI_ISL_FAKE_27, EPI_ISL_FAKE_36, EPI_ISL_FAKE_82, EPI_ISL_FAKE_173, EPI_ISL_FAKE_191, EPI_ISL_FAKE_35, EPI_ISL_FAKE_44, EPI_ISL_FAKE_63, EPI_ISL_FAKE_68, EPI_ISL_FAKE_14, EPI_ISL_FAKE_99, EPI_ISL_FAKE_76, EPI_ISL_FAKE_40, EPI_ISL_FAKE_148, EPI_ISL_FAKE_54, EPI_ISL_FAKE_131, EPI_ISL_FAKE_118, EPI_ISL_FAKE_192, EPI_ISL_FAKE_86, EPI_ISL_FAKE_175, EPI_ISL_FAKE_24, EPI_ISL_FAKE_42, EPI_ISL_FAKE_80, EPI_ISL_FAKE_33, EPI_ISL_FAKE_171, EPI_ISL_FAKE_97, EPI_ISL_FAKE_100, EPI_ISL_FAKE_72, EPI_ISL_FAKE_77, EPI_ISL_FAKE_58, EPI_ISL_FAKE_71, EPI_ISL_FAKE_5, EPI_ISL_FAKE_6, EPI_ISL_FAKE_163, EPI_ISL_FAKE_46, EPI_ISL_FAKE_75, EPI_ISL_FAKE_109, EPI_ISL_FAKE_172, EPI_ISL_FAKE_56, EPI_ISL_FAKE_85, EPI_ISL_FAKE_37, EPI_ISL_FAKE_103",0.25001169760493,"0.999999910032772, 0.250011731142283, 0.25001169760493, 0.665231323864378, 0.665231416859405, 0.658392582418303, 0.417268516217457, 0.540520128494, 0.540520129764147, 0.634888941284431, 0.543347160269108, 0.54334715901765, 0.223984253548372, 0.307852734776307, 0.307852694159031, 0.561141517597501, 0.478022104229135, 0.672936929838085, 0.451721642999272, 0.576951273612625, 0.928113517007868, 0.426044107001139, 0.388844529986916, 0.558070510666052, 0.999999990151785, 0.455368081551059, 0.222492966180987, 0.742207973071833, 0.233929362665733, 0.455368125588205, 0.225397323061327, 0.225397320648638, 0.52225527862392, 0.23652404185027, 0.261955899910955, 0.393017254045455, 0.928462715802927, 0.928462708457822, 0.27829327839137, 0.278293305627827, 0.455368162283767, 0.498522820781514, 0.498522824059625, 0.680783414696291, 0.692628172714344, 0.631945785323885, 0.631945628926768, 0.615683851721372, 0.680666819555392, 0.768101088440719, 0.687894659433673, 0.853574391740343, 0.853574424018565, 0.853574413921287, 0.557359592523211, 0.61993938385749, 0.984579811184392, 0.984580053078377, 0.984579645194518, 0.431895540306124, 0.431895494879706, 0.920343284803882, 0.890158570619071, 0.431895599053603, 0.431895690151416, 0.895118404958802, 0.895118399200965, 0.898381699915164, 0.554202389148254, 0.431895692622279, 0.43189565342348, 0.320334973206851, 0.470204574551472, 0.339051533067344, 0.232970757392859, 0.562108973320023, 0.513376691115572, 0.5306418477118, 0.245261916438038, 0.481606979274375, 0.481606840289569, 0.481606768766252, 0.999999766901814, 0.994806201336248, 0.481607132738058, 0.498485133948776, 0.258869940213435, 0.258869978530226, 0.996338041428429, 0.25887003144152, 0.638626348624056, 0.638626299887771",NA
0.261955899910955,0.196113740927565,0.0155571441260469,0.0156084502282397,0.0155550523978545,0.0513880722645367,0.0321952006507347,0.0176889253869213,0.0163418738518658,0.0160894338577512,0.0155555261619122,0.0155595978847889,0.0155546347246992,0.015560871116856,0.015554805641164,0.0155546498337601,0.0246110775477458,0.0155834420166969,0.21190373385386,0.0160678676160463,176,"Canada_Alberta",0.261955899910955,175,"46, 47, 48","United Kingdom","Canada_Alberta, Canada_Alberta, Canada_Nova Scotia",3,"EPI_ISL_FAKE_79, EPI_ISL_FAKE_91, EPI_ISL_FAKE_101",0.23652404185027,"0.631945785323885, 0.631945628926768, 0.615683851721372","nested"
3.82942106859912e-09,3.09645509342856e-09,3.09289320143669e-09,3.09295827317171e-09,3.09282103941941e-09,0.999999766901814,1.55489690140591e-07,1.05282588723621e-08,3.09484323183692e-09,3.09302261978331e-09,3.09284811461072e-09,3.09283269055784e-09,3.09281993299041e-09,3.09301709341966e-09,3.0928204000187e-09,3.09281990568639e-09,3.09321439924381e-09,3.31526692285519e-09,4.92068434548014e-09,1.4801498780234e-08,224,"Canada_Nova Scotia",0.999999766901814,223,"53, 54, 55","USA","Canada_Nova Scotia, Canada_Ontario, Canada_Ontario",3,"EPI_ISL_FAKE_82, EPI_ISL_FAKE_173, EPI_ISL_FAKE_191",0.481606768766252,"0.853574424018565, 0.853574413921287, 0.557359592523211","nested"
0.000154263110157783,0.000150675341329541,0.00014973776943959,0.000149754894390004,0.000149718770108007,0.000152419378736617,0.996338041428429,0.000424455800556669,0.000150251064395636,0.00014977183634765,0.000149725901055307,0.000149721845186385,0.000149718487547036,0.000149770351595387,0.000149718603174144,0.000149718497768499,0.000149822294041254,0.000447954316314236,0.000157810614671102,0.000376949694755974,230,"Canada_Ontario",0.996338041428429,229,"58, 59","Thailand","Canada_Ontario, Canada_Ontario",2,"EPI_ISL_FAKE_63, EPI_ISL_FAKE_68",0.258869978530226,"0.984580053078377, 0.984579645194518","nested"
0.00425259929831032,0.00466843714560054,0.0037992071108245,0.00313269733257601,0.00453699832965392,0.00398145327817727,0.00945015880578165,0.8871540387584,0.00841517296701924,0.00311329387699284,0.00310271245021975,0.00310501934175681,0.00310220757146309,0.0031057407091898,0.0031023042291136,0.00315411021451021,0.00318914303524215,0.00311852856813917,0.00477858911531533,0.0377375878617137,258,"Canada_Quebec",0.8871540387584,143,"116, 117, 118, 119, 120, 121, 122, 123, 124, 125, 126, 127, 128, 129, 130, 131, 132, 133, 134, 135, 136, 137, 138, 139, 140","China","USA, Canada_Quebec, Canada_Quebec, Canada_Quebec, Canada_British Columbia, Canada_Alberta, Canada_Quebec, USA, Canada_Ontario, USA, Canada_Quebec, Canada_Manitoba, Canada_Quebec, USA, Canada_British Columbia, Canada_Ontario, Canada_Nova Scotia, Canada_Ontario, South Africa, Canada_Newfoundland and Labrador, Canada_Ontario, United Kingdom, United Kingdom, Japan, Canada_Quebec",25,"EPI_ISL_FAKE_19, EPI_ISL_FAKE_29, EPI_ISL_FAKE_39, EPI_ISL_FAKE_41, EPI_ISL_FAKE_60, EPI_ISL_FAKE_81, EPI_ISL_FAKE_28, EPI_ISL_FAKE_92, EPI_ISL_FAKE_160, EPI_ISL_FAKE_110, EPI_ISL_FAKE_78, EPI_ISL_FAKE_135, EPI_ISL_FAKE_10, EPI_ISL_FAKE_17, EPI_ISL_FAKE_59, EPI_ISL_FAKE_176, EPI_ISL_FAKE_26, EPI_ISL_FAKE_165, EPI_ISL_FAKE_179, EPI_ISL_FAKE_30, EPI_ISL_FAKE_170, EPI_ISL_FAKE_190, EPI_ISL_FAKE_31, EPI_ISL_FAKE_65, EPI_ISL_FAKE_13",0.250011731142283,"0.343101586522819, 0.8871540387584, 0.897377120741145, 0.821540562099751, 0.821540422463389, 0.375126936564359, 0.36859093923992, 0.368591015797095, 0.357182630673051, 0.332823064289565, 0.900300728661969, 0.228419194231236, 0.999999850909656, 0.999999921276841, 0.887154040522056, 0.906244769558289, 0.929887258746582, 0.88715402424541, 0.82014791688745, 0.778766824901426, 0.778766839034321, 0.399879271739409, 0.535884708635693, 0.65017045140459, 0.999999251803602",NA
0.0072810546804045,0.0897325980472309,0.00727849348981574,0.00727472840824083,0.0107772812520338,0.36859093923992,0.153550835080658,0.105992675413188,0.0073045688581944,0.00727461879905638,0.00727455902508719,0.00727457205660625,0.00727455617941192,0.00727457613157612,0.00727455671906569,0.028820164836051,0.00727504726729143,0.00727464836957406,0.00729628288353041,0.147903243263064,263,"Canada_Nova Scotia",0.36859093923992,262,"130, 131, 132, 133, 134","USA","Canada_British Columbia, Canada_Ontario, Canada_Nova Scotia, Canada_Ontario, South Africa",5,"EPI_ISL_FAKE_59, EPI_ISL_FAKE_176, EPI_ISL_FAKE_26, EPI_ISL_FAKE_165, EPI_ISL_FAKE_179",0.375126936564359,"0.887154040522056, 0.906244769558289, 0.929887258746582, 0.88715402424541, 0.82014791688745","nested"
